reference,name,latitude,longitude,grid,locationDesc,attempts,activations,qsos,my_activations,my_hunted_qsos
CA-4891,Ardgowan National Historic Site,46.2521,-63.1275,FN86kg,CA-PE,17,16,482,0,0
CA-4893,Green Gables Heritage Place (L.M. Montgomery's Cavendish NHS) National Historic Site,46.4905,-63.3824,FN86hl,CA-PE,26,25,772,0,0
CA-4894,Skmaqn-Port-la-Joye-Fort Amherst National Historic Site,46.1957,-63.1362,FN86ke,CA-PE,15,15,636,0,0
CA-4896,Battle of the Chateauguay National Historic Site,45.1587,-73.929,FN35ad,CA-QC,47,47,1654,0,0
CA-4897,Battle of the Restigouche National Historic Site,48.0144,-66.7349,FN68pa,CA-QC,7,7,325,0,0
CA-4898,Carillon Barracks National Historic Site,45.5649,-74.3716,FN25tn,CA-QC,12,11,382,0,0
CA-4899,Carillon Canal National Historic Site,45.568,-74.3764,FN25tn,CA-QC,18,11,349,0,0
CA-4900,Cartier-Brébeuf National Historic Site,46.8258,-71.2392,FN46jt,CA-QC,4,3,102,0,0
CA-4901,Chambly Canal National Historic Site,45.4087,-73.2539,FN35ij,CA-QC,25,22,516,0,0
CA-4902,Coteau du Lac National Historic Site,45.2878,-74.1775,FN25vg,CA-QC,25,23,1461,0,0
CA-4903,Forges du Saint Maurice National Historic Site,46.3951,-72.6596,FN36qj,CA-QC,9,9,334,0,0
CA-4904,Fort Chambly National Historic Site,45.4492,-73.2778,FN35ik,CA-QC,15,13,319,0,0
CA-4905,Fort Lennox National Historic Site,45.1208,-73.2689,FN35ic,CA-QC,5,5,169,0,0
CA-4906,57 63 St. Louis Street National Historic Site,46.8109,-71.2086,FN46jt,CA-QC,5,3,33,0,0
CA-4907,Fort Ste. Therese National Historic Site,45.3974,-73.2601,FN35ij,CA-QC,7,7,175,0,0
CA-4908,Fort Temiscamingue National Historic Site,47.2903,-79.4569,FN07gg,CA-QC,5,4,137,0,0
CA-4909,Fortifications of Quebec National Historic Site,46.8094,-71.2117,FN46jt,CA-QC,18,17,272,0,0
CA-4910,Grosse Ile and the Irish Memorial National Historic Site,47.0298,-70.666,FN47qa,CA-QC,1,1,72,0,0
CA-4911,Lachine Canal National Historic Site,45.4311,-73.666,FN35ek,CA-QC,10,10,281,0,0
CA-4912,Levis Forts National Historic Site,46.815,-71.158,FN46kt,CA-QC,5,5,160,0,0
CA-4913,Louis S. St. Laurent National Historic Site,45.242,-71.8263,FN45cf,CA-QC,4,4,60,0,0
CA-4914,Louis-Joseph Papineau National Historic Site,45.51,-73.5523,FN35fm,CA-QC,6,6,65,0,0
CA-4915,Maillou House National Historic Site,46.8119,-71.2064,FN46jt,CA-QC,3,3,38,0,0
CA-4916,Manoir Papineau National Historic Site,45.6499,-74.9431,FN25mp,CA-QC,6,5,206,0,0
CA-4917,Montmorency Park National Historic Site,46.8139,-71.2047,FN46jt,CA-QC,7,6,94,0,0
CA-4918,Pointe-au-Père Lighthouse National Historic Site,48.5165,-68.4695,FN58sm,CA-QC,13,11,365,0,0
CA-4919,Quebec Garrison Club National Historic Site,46.8095,-71.2112,FN46jt,CA-QC,6,6,75,0,0
CA-4920,Sainte-Anne-de-Bellevue Canal National Historic Site,45.4049,-73.9566,FN35aj,CA-QC,10,10,259,0,0
CA-4921,Saint Louis Forts and Chateaux National Historic Site,46.811,-71.2045,FN46jt,CA-QC,5,5,59,0,0
CA-4922,Saint-Ours Canal National Historic Site,45.865,-73.1463,FN35ku,CA-QC,18,18,648,0,0
CA-4923,Sir George-Étienne Cartier National Historic Site,45.5111,-73.5517,FN35fm,CA-QC,7,6,82,0,0
CA-4924,Sir Wilfrid Laurier National Historic Site,45.8524,-73.7577,FN35cu,CA-QC,3,3,78,0,0
CA-4925,The Fur Trade at Lachine National Historic Site,45.4313,-73.6756,FN35dk,CA-QC,8,8,186,0,0
CA-4926,Batoche National Historic Site,52.7528,-106.117,DO62ws,CA-SK,5,5,114,0,0
CA-4927,Battle of Tourond's Coulee / Fish Creek National Historic Site,52.5396,-106.148,DO62wm,CA-SK,5,5,311,0,0
CA-4928,Cypress Hills Massacre National Historic Site,49.5505,-109.889,DN59bn,CA-SK,3,3,37,0,0
CA-4929,Fort Battleford National Historic Site,52.7272,-108.296,DO52ur,CA-SK,7,7,125,0,0
CA-4930,Fort Esperance National Historic Site,50.4922,-101.577,DO90fl,CA-SK,1,1,27,0,0
CA-4931,Fort Livingstone National Historic Site,51.9039,-101.96,DO91av,CA-SK,2,2,49,0,0
CA-4932,Fort Pelly National Historic Site,51.7764,-101.997,DO91as,CA-SK,1,1,15,0,0
CA-4933,Fort Walsh National Historic Site,49.5637,-109.879,DN59bn,CA-SK,6,5,81,0,0
CA-4934,Frenchman Butte National Historic Site,53.6273,-109.576,DO53fp,CA-SK,1,1,18,0,0
CA-4936,Dawson Historical Complex National Historic Site,64.05,-139.433,CP04gb,CA-YT,0,0,0,0,0
CA-4937,Dredge No. 4 National Historic Site,63.9458,-139.33,CP03iw,CA-YT,2,1,13,0,0
CA-4938,Former Territorial Court House National Historic Site,64.0563,-139.441,CP04gb,CA-YT,1,1,13,0,0
CA-4939,S.S. Keno National Historic Site,64.0675,-139.429,CP04gb,CA-YT,2,1,18,0,0
CA-4940,S.S. Klondike National Historic Site,60.7294,-135.047,CP20lr,CA-YT,19,14,240,0,0
CA-4942,Captain James Cook National Historic Site,48.9542,-57.9628,GN18aw,CA-NL,15,13,337,0,0
CA-4943,Fort Nerepis National Historic Site,45.37,-66.2342,FN65vi,CA-NB,6,6,158,0,0
CA-4944,Fort Howe National Historic Site,45.2781,-66.0704,FN65xg,CA-NB,8,7,326,0,0
CA-4945,Base de plein air Sainte-Foy Regional Park,46.7866,-71.3337,FN46hs,CA-QC,7,7,104,0,0
CA-4946,Canyon des Portes de l'Enfer Regional Park,48.2295,-68.5047,FN58rf,CA-QC,5,5,153,0,0
CA-4947,Parc Nature Eco-Odyssee Regional Park,45.6395,-75.8838,FN25bp,CA-QC,7,6,191,0,0
CA-4948,Parc regional du Mont-Saint-Joseph Regional Park,48.1362,-66.1214,FN68wd,CA-QC,33,27,838,0,0
CA-4949,Parc Aventures Cap Jaseux Regional Park,48.426,-70.8204,FN48ok,CA-QC,5,5,156,0,0
CA-4950,Parc cotier Kiskotuk Regional Park,47.9401,-69.4971,FN57gw,CA-QC,35,32,848,0,0
CA-4951,Parc de Gros-Cap Regional Park,47.3467,-61.882,FN97bi,CA-QC,5,4,208,0,0
CA-4952,Parc de la caverne Trou de la Fee Regional Park,48.3746,-71.9722,FN48ai,CA-QC,7,7,204,0,0
CA-4953,Parc de la Gorge de Coaticook Regional Park,45.1453,-71.7981,FN45cd,CA-QC,4,4,93,0,0
CA-4954,Parc de la Riviere de Terrebonne Regional Park,45.6912,-73.6942,FN35dq,CA-QC,17,17,439,0,0
CA-4955,Parc d'Escalade et de Randonnee de la Montagne d'Argent Regional Park,46.1262,-74.6802,FN26pd,CA-QC,5,5,160,0,0
CA-4956,Parc des Chutes Regional Park,47.831,-69.5302,FN57ft,CA-QC,54,48,1034,0,0
CA-4957,Parc des Chutes de Sainte-Ursule Regional Park,46.3014,-73.094,FN36kh,CA-QC,5,5,117,0,0
CA-4958,Parc des Chutes Dorwin Regional Park,46.0323,-73.7034,FN36da,CA-QC,7,5,82,0,0
CA-4959,Parc Les Salines Regional Park,45.648,-72.9576,FN35mp,CA-QC,92,85,2688,0,0
CA-4960,Parc Michel-Chartrand Regional Park,45.5423,-73.4714,FN35gn,CA-QC,18,18,562,0,0
CA-4961,Parc Nature La Gabelle Regional Park,46.4502,-72.7378,FN36pk,CA-QC,9,9,216,0,0
CA-4962,Parc naturel regional de Portneuf Regional Park,46.7104,-72.0775,FN36xr,CA-QC,4,4,107,0,0
CA-4963,Parc regional de la Chute-a-Bull Regional Park,46.3072,-73.7597,FN36ch,CA-QC,3,3,42,0,0
CA-4964,Parc regional de la riviere Gentilly Regional Park,46.3348,-72.2381,FN36vi,CA-QC,7,7,176,0,0
CA-4965,Parc régional de la rivière Mitis Regional Park,48.6278,-68.1406,FN58wp,CA-QC,5,5,131,0,0
CA-4966,Parc regional de la Seigneurie-du-Lac-Matapedia Regional Park,48.5155,-67.4229,FN68gm,CA-QC,3,3,74,0,0
CA-4967,Parc regional des Grandes-Coulees Regional Park,46.2778,-71.7847,FN46cg,CA-QC,18,15,550,0,0
CA-4968,Parc régional des Grandes-Rivières du lac Saint-Jean Regional Park,48.8901,-72.2232,FN38vv,CA-QC,6,6,177,0,0
CA-4969,Parc regional des Sept-Chutes Regional Park,46.4717,-73.7217,FN36dl,CA-QC,6,5,198,0,0
CA-4970,Parc regional du Lac 31 Milles Regional Park,46.1929,-75.8308,FN26ce,CA-QC,5,5,230,0,0
CA-4971,Parc regional du Lac Taureau Regional Park,46.7762,-73.9536,FN36as,CA-QC,4,4,106,0,0
CA-4972,Parc regional Kiamika Regional Park,46.604,-75.0274,FN26lo,CA-QC,6,6,170,0,0
CA-4973,Parc des Voltigeurs Regional Park,45.9158,-72.4866,FN35sv,CA-QC,28,24,624,0,0
CA-4974,Parc du Sanctuaire St-Majorique Regional Park,45.947,-72.5284,FN35rw,CA-QC,45,43,1495,0,0
CA-4975,Parc regional de la Foret Drummond Regional Park,45.9585,-72.5516,FN35rx,CA-QC,57,54,1720,0,0
CA-4976,Parc de la Rivière Batiscan Regional Park,46.5546,-72.4115,FN36tn,CA-QC,11,11,316,0,0
CA-4977,Côte Boisée Regional Park,45.7101,-73.6621,FN35er,CA-QC,18,18,521,0,0
CA-4978,Parc regional Saint-Bernard Regional Park,45.046,-73.431,FN35gb,CA-QC,10,10,307,0,0
CA-4979,Parc ecologique Godefroy Regional Park,46.3027,-72.5355,FN36rh,CA-QC,11,10,297,0,0
CA-4980,Marais Laperriere Regional Park,47.3091,-79.4531,FN07gh,CA-QC,3,3,111,0,0
CA-4981,Rivière-à-Mars (Passe à Saumons) Regional Park,48.327,-70.907,FN48nh,CA-QC,6,5,120,0,0
CA-4982,Parc des Chutes Rouillard Regional Park,46.6202,-70.9444,FN46mo,CA-QC,10,9,353,0,0
CA-4983,La Foret recreative de Val-d'Or Regional Park,48.0587,-77.7922,FN18cb,CA-QC,2,2,75,0,0
CA-4984,Centre d'interpretation de la nature du lac Boivin (CINLB) Regional Park,45.4165,-72.686,FN35pj,CA-QC,9,9,225,0,0
CA-4985,Parc historique de la Poudriere de Windsor Regional Park,45.5792,-71.9902,FN45an,CA-QC,6,6,84,0,0
CA-4986,Parc de la Baie-des-Rochers Regional Park,47.9537,-69.8128,FN57cw,CA-QC,6,5,160,0,0
CA-4987,Parc de la chute Sainte-Agathe-de-Lotbiniere Regional Park,46.3341,-71.4208,FN46gi,CA-QC,10,9,349,0,0
CA-4988,Parc de la Promenade-Bellerive Regional Park,45.5951,-73.5095,FN35fo,CA-QC,417,408,13282,0,0
CA-4989,Les Portes du bout du monde Regional Park,48.8681,-79.5141,FN08fu,CA-QC,2,2,86,0,0
CA-4990,Le Bois de l'équerre Regional Park,45.6074,-73.7645,FN35co,CA-QC,24,21,652,0,0
CA-4991,Centre d'interpretation du Ruisseau McFee Regional Park,45.0597,-73.1624,FN35kb,CA-QC,6,6,107,0,0
CA-4992,Foret Piche-Lemoine Regional Park,48.0881,-77.9133,FN18bc,CA-QC,4,4,111,0,0
CA-4993,Station touristique Duchesnay Regional Park,46.8675,-71.6421,FN46eu,CA-QC,5,5,118,0,0
CA-4994,Parc Daniel-Johnson Regional Park,45.4023,-72.7075,FN35pj,CA-QC,17,15,403,0,0
CA-4995,Parc de la Pointe Regional Park,47.8603,-69.5521,FN57fu,CA-QC,59,58,1908,0,0
CA-4996,Parc de la Riviere-Bourbon Regional Park,46.2147,-71.772,FN46cf,CA-QC,10,10,232,0,0
CA-4997,Parc écomaritime de l'Anse-du-Port Regional Park,46.2516,-72.6392,FN36qg,CA-QC,8,8,221,0,0
CA-4998,Site regional de la montagne de la Croix Regional Park,47.6981,-70.2492,FN47vq,CA-QC,5,5,123,0,0
CA-4999,Archipel des Sept Iles Regional Park,50.1595,-66.366,FO60td,CA-QC,0,0,0,0,0
CA-5000,Centre d'interpretation des marais sales Regional Park,48.5846,-69.1994,FN58jo,CA-QC,2,2,21,0,0
CA-5001,Parc des Chutes de Montauban Regional Park,46.8868,-72.3026,FN36uv,CA-QC,4,4,107,0,0
CA-5002,Parc des Montagnes Noires de Ripon Regional Park,45.8072,-75.162,FN25kt,CA-QC,4,4,109,0,0
CA-5003,Parc regional Obalski Regional Park,49.9097,-74.3567,FN29tv,CA-QC,3,2,70,0,0
CA-5004,Centre de plein air du Lac-Leamy Regional Park,45.4537,-75.7259,FN25dk,CA-QC,50,43,1223,0,0
CA-5005,Parc des Rapides Regional Park,45.4295,-73.5932,FN35ek,CA-QC,82,64,1501,0,0
CA-5006,Chute Kabir Kouba Regional Park,46.8559,-71.3548,FN46hu,CA-QC,7,6,106,0,0
CA-5007,Parc des Chutes-de-la-Chaudière Regional Park,46.7174,-71.2823,FN46ir,CA-QC,60,57,1267,0,0
CA-5008,Societe de conservation d'interpretation et de recherche de Berthier et ses Iles Regional Park,46.0847,-73.1642,FN36kc,CA-QC,4,4,128,0,0
CA-5009,Refuge faunique Marguerite-D'Youville (Ile Saint-Bernard) Wildlife Refuge,45.3853,-73.7674,FN35cj,CA-QC,8,8,171,0,0
CA-5010,Parc René-Lévesque Regional Park,45.429,-73.6712,FN35dk,CA-QC,24,20,590,0,0
CA-5011,Baie de Beauport Regional Park,46.8364,-71.2018,FN46ju,CA-QC,3,3,30,0,0
CA-5012,Marais de la Rivière-aux-Cerises Regional Park,45.2824,-72.1798,FN35vg,CA-QC,7,6,104,0,0
CA-5013,Parc du Boisé-des-Frères-du-Sacré-Coeur Regional Park,46.0349,-71.9187,FN46aa,CA-QC,11,9,199,0,0
CA-5014,Parc Valero Les écarts Regional Park,46.7732,-71.1749,FN46js,CA-QC,12,11,335,0,0
CA-5015,Chute a Philomene Regional Park,48.4651,-67.3421,FN68hl,CA-QC,2,2,41,0,0
CA-5016,Sentier pedestre et poste d'observation Grand Heron Regional Park,48.8218,-78.9999,FN08mt,CA-QC,2,2,32,0,0
CA-5017,Parc du Reservoir-Beaudet Regional Park,46.068,-71.9778,FN46ab,CA-QC,10,9,231,0,0
CA-5018,Promenade de la Gorge de la Magog Regional Park,45.4,-71.9001,FN45bj,CA-QC,7,7,283,0,0
CA-5019,Parc regional des Iles-de-Saint-Timothee Regional Park,45.292,-74.0509,FN25xh,CA-QC,47,46,1904,0,0
CA-5020,Domaine de Maizerets Regional Park,46.8364,-71.2154,FN46ju,CA-QC,7,6,72,0,0
CA-5021,Parc de la Pointe Taylor Regional Park,48.1555,-65.8494,FN78bd,CA-QC,29,26,713,0,0
CA-5022,Parc du Mont-Bellevue Regional Park,45.3773,-71.9087,FN45bj,CA-QC,10,10,166,0,0
CA-5023,Centre ecologique Fernand-Seguin Regional Park,45.342,-73.769,FN35ci,CA-QC,10,10,336,0,0
CA-5024,Parc Bellerive (Beaulac-Garthby) Regional Park,45.833,-71.3786,FN45ht,CA-QC,10,9,204,0,0
CA-5025,Domaine du Radar Regional Park,46.3263,-71.1542,FN46kh,CA-QC,34,32,2023,0,0
CA-5026,Parc de la Frontiere Regional Park,47.4594,-69.225,FN57jl,CA-QC,9,9,198,0,0
CA-5027,Parc du Sacre-Coeur (Saint-Felicien) Regional Park,48.6539,-72.4472,FN38sp,CA-QC,6,6,148,0,0
CA-5028,Chute Manitou Regional Park,50.317,-65.2446,FO70jh,CA-QC,2,2,129,0,0
CA-5029,Parc historique de la Pointe-du-Moulin Regional Park,45.368,-73.858,FN35bi,CA-QC,10,9,260,0,0
CA-5030,Parc des Chutes Coulonge Regional Park,45.8753,-76.6872,FN15pv,CA-QC,5,5,138,0,0
CA-5031,Centre ecologique de Port-au-Saumon Regional Park,47.7647,-69.9515,FN57as,CA-QC,4,4,107,0,0
CA-5032,Centre de la nature de Laval Regional Park,45.6076,-73.6637,FN35eo,CA-QC,37,34,1135,0,0
CA-5033,Parc Bernard-Landry Regional Park,45.5552,-73.6953,FN35dn,CA-QC,28,28,656,0,0
CA-5034,Bois Summit Regional Park,45.4914,-73.6049,FN35el,CA-QC,7,7,173,0,0
CA-5035,Parc de la riviere Bell Regional Park,49.7573,-77.6166,FN19es,CA-QC,2,2,29,0,0
CA-5036,Parc familial des Berges Regional Park,46.683,-71.7413,FN46dq,CA-QC,6,5,57,0,0
CA-5037,Site patrimonial de la Visitation Regional Park,46.7783,-71.3029,FN46is,CA-QC,5,5,63,0,0
CA-5038,Parc de l'etang Burbank Regional Park,45.783,-72.0084,FN35xs,CA-QC,25,24,600,0,1
CA-5039,Parc ecologique Le Renouveau Rosaire-Senecal Regional Park,46.4393,-75.0319,FN26lk,CA-QC,5,5,120,0,0
CA-5040,Parc Lucien-Blanchard Regional Park,45.3941,-71.9279,FN45aj,CA-QC,38,38,1353,0,1
CA-5041,Parc regional du Mont Morissette Regional Park,46.2195,-76.0997,FN16wf,CA-QC,19,16,614,0,0
CA-5042,Sentiers pédestres Neil-Tillotson Regional Park,45.0921,-71.5499,FN45fc,CA-QC,16,14,724,0,0
CA-5043,Parc Saint-Jean-Bosco Regional Park,46.048,-73.4433,FN36gb,CA-QC,6,6,126,0,0
CA-5044,Parc ecoforestier de Johnville Regional Park,45.3452,-71.7581,FN45ci,CA-QC,11,11,274,0,0
CA-5045,Domaine Taschereau - Parc nature Regional Park,46.4443,-71.0348,FN46lk,CA-QC,9,7,424,0,0
CA-5046,Parc du Mont Arthabaska Regional Park,46.0369,-71.9034,FN46ba,CA-QC,15,14,440,0,0
CA-5047,Sentier ecologique de Nedelec Regional Park,47.6888,-79.426,FN07gq,CA-QC,3,3,93,0,0
CA-5048,Parc du Bois-Beckett Regional Park,45.4173,-71.9312,FN45ak,CA-QC,8,7,155,0,0
CA-5049,Parc Harold F. Baldwin (Mont Pinacle) Regional Park,45.0355,-71.9061,FN45ba,CA-QC,11,10,258,0,0
CA-5050,Parc des Pionniers (Saint-Donat) Regional Park,46.3141,-74.2268,FN26vh,CA-QC,5,4,74,0,0
CA-5051,Parc du Marecage-des-Scots Regional Park,45.4963,-71.2238,FN45jl,CA-QC,5,5,140,0,0
CA-5052,Parc Nature de Pointe-aux-Outardes Regional Park,49.0422,-68.4513,FN59sb,CA-QC,2,2,23,0,0
CA-5053,Parc des Chutes-de-la Petite-Rivière-Bostonnais Regional Park,47.3831,-72.7807,FN37oj,CA-QC,32,27,785,0,0
CA-5054,Foret Montmorency Regional Park,47.3098,-71.1813,FN47jh,CA-QC,11,11,280,0,0
CA-5055,Les Sentiers de la Presqu'île Regional Park,45.7572,-73.5121,FN35fs,CA-QC,9,9,285,0,0
CA-5056,Parc du Grand-Heron Regional Park,46.845,-71.6245,FN46eu,CA-QC,5,5,117,0,0
CA-5057,Le site des Chutes et Marais Regional Park,48.4648,-67.2336,FN68jl,CA-QC,2,2,27,0,0
CA-5058,Parc Beausejour Regional Park,48.4371,-68.5368,FN58rk,CA-QC,10,10,175,0,0
CA-5059,Parc d'environnement naturel de Sutton Regional Park,45.0969,-72.549,FN35rc,CA-QC,13,13,401,0,0
CA-5060,Parc de la Riviere-aux-Rochers - Piege a saumon Regional Park,50.027,-66.87,FO60na,CA-QC,2,2,35,0,0
CA-5061,Parc de la riviere Doncaster Regional Park,45.9731,-74.085,FN25wx,CA-QC,3,3,31,0,0
CA-5062,Chutes de Plaisance Regional Park,45.6409,-75.133,FN25kp,CA-QC,10,9,166,0,0
CA-5063,Parc de la foret ancienne du Mont Wright Regional Park,47.0078,-71.3503,FN47ha,CA-QC,4,4,108,0,0
CA-5064,Centre d'observation du saumon atlantique Regional Park,48.8436,-67.5299,FN68fu,CA-QC,2,2,25,0,0
CA-5065,Domaine Saint-Bernard Regional Park,46.181,-74.5688,FN26re,CA-QC,25,25,631,0,0
CA-5066,Parc des Chutes d'Armagh Regional Park,46.7296,-70.5595,FN46rr,CA-QC,6,6,181,0,0
CA-5067,Parc Decouverte Nature Regional Park,45.0472,-71.9099,FN45bb,CA-QC,5,5,102,0,0
CA-5068,Parc des Moulins (Qc) Regional Park,46.8901,-71.2987,FN46iv,CA-QC,8,8,132,0,0
CA-5069,Parc André-Auger Regional Park,45.8512,-73.7575,FN35cu,CA-QC,8,7,103,0,0
CA-5070,Chute a Grandmaison Regional Park,48.351,-77.2785,FN18ii,CA-QC,3,3,58,0,0
CA-5071,Parc des Rapides-du-Diable Regional Park,46.1989,-70.7513,FN46oe,CA-QC,12,12,314,0,0
CA-5072,Parc de la Taiga Regional Park,50.0227,-66.8695,FO60na,CA-QC,2,2,51,0,0
CA-5073,Parc des Deux Rivieres Regional Park,45.4752,-71.6537,FN45el,CA-QC,7,7,114,0,0
CA-5074,Arboretum de la Presqu'Ile Croft Regional Park,48.3983,-71.7742,FN48cj,CA-QC,7,7,204,0,0
CA-5075,Marais Real-D.-Carbonneau Regional Park,45.4151,-71.9006,FN45bj,CA-QC,25,25,1170,0,0
CA-5076,Parc de l'Ile Ronde de Beauceville Regional Park,46.2099,-70.7755,FN46of,CA-QC,9,9,341,0,0
CA-5077,Parc de la Riviere-aux-Sables Regional Park,48.4103,-71.2591,FN48ij,CA-QC,10,10,254,0,0
CA-5078,Montagne a Coton Regional Park,47.541,-69.8114,FN57cm,CA-QC,13,13,330,0,0
CA-5079,Parc du Temps-qui-passe Regional Park,45.3015,-72.3177,FN35uh,CA-QC,5,5,66,0,0
CA-5080,Reseau du mont Oak Regional Park,45.3046,-72.6806,FN35ph,CA-QC,6,6,179,0,0
CA-5081,International Appalachian Trail (IAT) National Scenic Trail,46.7653,-67.7894,FN66cs,"CA-NB,CA-NL,CA-NS,CA-PE,CA-QC",57,52,2253,0,0
CA-5082,The Trans Canada Trail National Scenic Trail,46.861,-52.9446,GN36mu,"CA-AB,CA-BC,CA-MB,CA-NB,CA-NL,CA-NS,CA-NT,CA-NU,CA-ON,CA-PE,CA-QC,CA-SK,CA-YT",4614,4451,190797,75,12
CA-5083,Diefenbunker National Historic Site,45.3505,-76.0462,FN15xi,CA-ON,496,202,6170,0,0
CA-5084,South March Highlands Conservation Forest Natural Area,45.3462,-75.9463,FN25ai,CA-ON,32,29,753,0,0
CA-5085,Stonehammer UNESCO Global Geopark Geopark,45.2691,-66.1239,FN65wg,CA-NB,51,38,3204,0,0
CA-5086,Seymour Conservation Area,44.2753,-77.8085,FN14cg,CA-ON,81,70,2502,0,0
CA-5087,Enniskillen Conservation Area,44.0022,-78.7749,FN04oa,CA-ON,37,33,1157,0,0
CA-5088,King's Mill Conservation Area,44.3316,-77.6281,FN14eh,CA-ON,25,25,1042,0,0
CA-5089,Sager Conservation Area,44.2474,-77.5405,FN14ff,CA-ON,29,26,751,0,0
CA-5090,Albion Hills Conservation Park,43.9262,-79.8346,FN03bw,CA-ON,24,23,575,0,1
CA-5091,Birdsall Wildlife Area,44.2843,-78.0813,FN04xg,CA-ON,22,22,476,0,0
CA-5092,Bruce's Caves Conservation Area,44.7687,-81.0847,EN94ks,CA-ON,4,4,60,0,0
CA-5093,Bruce's Mill Conservation Area,43.9492,-79.3458,FN03hw,CA-ON,49,47,1385,0,0
CA-5094,Central Chambers National Historic Site,45.4232,-75.6952,FN25dk,CA-ON,13,12,319,0,0
CA-5095,Central Experimental Farm National Historic Site,45.3877,-75.7088,FN25dj,CA-ON,121,113,3834,0,0
CA-5096,Claireville Conservation Area,43.7601,-79.672,FN03ds,CA-ON,57,53,1932,0,0
CA-5099,Forested Dunes Nature Reserve,43.2225,-81.908,EN93bf,CA-ON,13,12,282,0,0
CA-5100,Glen Haffy Conservation Area,43.9341,-79.9536,FN03aw,CA-ON,17,17,490,0,0
CA-5101,Glenorchy Conservation Area,43.4595,-79.7814,FN03cl,CA-ON,39,36,1568,0,0
CA-5102,Harold Town Conservation Area,44.3224,-78.2613,FN04uh,CA-ON,49,46,1099,0,0
CA-5103,Heart Lake Conservation Area,43.7409,-79.7872,FN03cr,CA-ON,19,19,498,0,0
CA-5104,Hope Mill Conservation Area,44.2837,-78.1719,FN04vg,CA-ON,35,33,850,0,0
CA-5105,Kelso Conservation Area,43.5104,-79.9373,FN03am,CA-ON,38,37,1392,0,0
CA-5106,Langevin National Historic Site,45.4238,-75.6973,FN25dk,CA-ON,8,7,97,0,0
CA-5107,Mark's Bay Conservation Area,46.4914,-84.4864,EN76sl,CA-ON,6,6,142,0,0
CA-5108,Nashville Conservation Reserve,43.8605,-79.6685,FN03du,CA-ON,21,20,556,0,0
CA-5109,National Arts Centre National Historic Site,45.4233,-75.6934,FN25dk,CA-ON,29,27,1128,0,0
CA-5110,Notre-Dame Roman Catholic Basilica National Historic Site,45.4304,-75.6949,FN25dk,CA-ON,21,18,560,0,0
CA-5111,Oak Ridges Corridor Conservation Reserve,43.9348,-79.4528,FN03gw,CA-ON,157,139,4898,0,0
CA-5112,Palgrave Forest and Wildlife Area,43.9518,-79.8551,FN03bw,CA-ON,24,24,631,0,0
CA-5113,Parliament Buildings National Historic Site,45.4238,-75.7009,FN25dk,CA-ON,1,1,18,0,0
CA-5114,Pier 4 Park,43.2729,-79.866,FN03bg,CA-ON,104,103,4153,0,0
CA-5115,Public Grounds of the Parliament Buildings National Historic Site,45.4238,-75.7009,FN25dk,CA-ON,10,9,165,0,0
CA-5116,Rideau Hall and Landscaped Grounds National Historic Site,45.4446,-75.6858,FN25dk,CA-ON,14,10,199,0,0
CA-5117,Royal Canadian Mint National Historic Site,45.4315,-75.6991,FN25dk,CA-ON,7,6,167,0,0
CA-5118,Selwyn Beach Conservation Reserve,44.4777,-78.3415,FN04tl,CA-ON,18,18,419,0,0
CA-5119,Assiniboine Forest Forest Reserve,49.8583,-97.2504,EN19iu,CA-MB,4,4,68,0,0
CA-5120,Buhler Recreation Park,49.8793,-96.9815,EN19mv,CA-MB,2,2,119,0,0
CA-5121,Crescent Drive Park Recreation Park,49.8378,-97.1373,EN19ku,CA-MB,24,20,1301,0,0
CA-5122,Fraser's Grove Park Recreation Park,49.9371,-97.1004,EN19kw,CA-MB,2,2,26,0,0
CA-5123,Kilcona Park Recreation Park,49.9361,-97.0366,EN19lw,CA-MB,9,8,307,0,0
CA-5124,La Barriere Park Recreation Park,49.7217,-97.1709,EN19jr,CA-MB,16,16,1534,0,0
CA-5125,Little Mountain Park Recreation Park,49.9547,-97.2517,EN19iw,CA-MB,8,8,527,0,0
CA-5126,Maple Grove Park Recreation Park,49.7928,-97.1159,EN19kt,CA-MB,12,12,549,0,0
CA-5127,Neepawa Court House / Beautiful Plains County Court Building National Historic Site,50.2284,-99.4653,EO00gf,CA-MB,7,3,206,0,0
CA-5129,Shirley Render Park Recreation Park,49.8279,-97.1364,EN19kt,CA-MB,1,1,31,0,0
CA-5130,Big Manitou Regional Park,52.7975,-109.787,DO52ct,CA-SK,0,0,0,0,0
CA-5131,Melville Railway Station National Historic Site,50.9262,-102.807,DO80ow,CA-SK,3,2,43,0,0
CA-5132,L'Anse Amour National Historic Site,51.4613,-56.8576,GO11nl,CA-NL,9,7,190,0,0
CA-5134,Gateway Wetland Nature Trails Conservation Area,45.8351,-66.49,FN65su,CA-NB,8,8,745,0,0
CA-5135,Sir Douglas Hazen Recreation Park,45.8531,-66.4762,FN65su,CA-NB,5,5,192,0,0
CA-5136,Fort Hughes Military Blockhouse National Historic Site,45.8526,-66.4772,FN65su,CA-NB,5,5,178,0,0
CA-5137,Thatch Road Trail (MacDougal) National Recreation Trail,45.8684,-66.5074,FN65ru,CA-NB,6,6,282,0,0
CA-5138,Odell Park and Odell Arboretum Recreation Park,45.9573,-66.6633,FN65qw,CA-NB,3,3,193,0,0
CA-5139,Saskatchewan Legislative Building and Grounds National Historic Site,50.4333,-104.615,DO70qk,CA-SK,10,9,226,0,0
CA-5140,Saskatoon Railway Station (Canadian Pacific) National Historic Site,52.132,-106.671,DO62pd,CA-SK,3,2,121,0,0
CA-5141,Lemoine Point Conservation Area,44.2323,-76.6097,FN14qf,CA-ON,268,268,7432,0,0
CA-5142,Parrott's Bay Conservation Area,44.2143,-76.6941,FN14pf,CA-ON,250,249,6347,0,1
CA-5143,Marshlands Conservation Area,44.2205,-76.5385,FN14rf,CA-ON,69,67,2108,0,0
CA-5144,Gooseberry Lake Provincial Park,52.1205,-110.751,DO42oc,CA-AB,1,1,39,0,0
CA-5145,Maskepetoon Natural Area,52.2757,-113.862,DO32bg,CA-AB,3,3,42,0,0
CA-5146,Watson Creek Provincial Recreation Area,53.074,-117.27,DO13ib,CA-AB,1,1,35,0,0
CA-5147,1 Chipman Hill National Historic Site,45.2742,-66.0628,FN65xg,CA-NB,2,2,96,0,0
CA-5148,Arts Building National Historic Site,45.9482,-66.6411,FN65qw,CA-NB,4,4,164,0,0
CA-5149,Bayswater Lighthouse National Heritage Site,45.3505,-66.1337,FN65wi,CA-NB,4,4,91,0,0
CA-5150,Beardsley Hill Nature Reserve,46.1322,-67.6147,FN66ed,CA-NB,3,3,156,0,0
CA-5151,Beausoleil Nature Reserve,45.1537,-67.3105,FN65id,CA-NB,0,0,0,0,0
CA-5152,Beldings Reef Nature Reserve,45.1176,-66.3538,FN65tc,CA-NB,1,1,22,0,0
CA-5153,Butternut Island Nature Reserve,46.058,-66.22,FN66vb,CA-NB,0,0,0,0,0
CA-5154,Cape Jourimain Lighthouse National Heritage Site,46.1576,-63.8065,FN86cd,CA-NB,14,14,793,0,0
CA-5155,Chandler House / Rocklyn National Historic Site,45.8987,-64.5151,FN75rv,CA-NB,9,7,306,0,0
CA-5156,Christ Church Anglican National Historic Site,45.8714,-66.4465,FN65su,CA-NB,2,2,104,0,0
CA-5157,Christ Church Cathedral National Historic Site,45.9571,-66.635,FN65qw,CA-NB,2,2,150,0,0
CA-5158,Clark Gregory Nature Reserve,44.9507,-66.9698,FN64mw,CA-NB,2,2,143,0,0
CA-5159,Connell House National Historic Site,46.1506,-67.5751,FN66fd,CA-NB,3,2,105,0,0
CA-5160,Connell Park Recreation Park,46.1633,-67.5822,FN66fd,CA-NB,5,5,172,0,0
CA-5161,Connors Bros. Preserve Nature Reserve,45.0452,-66.8041,FN65ob,CA-NB,5,5,233,0,0
CA-5162,Coronation Park Recreation Park,47.6143,-65.6552,FN77eo,CA-NB,91,12,597,0,0
CA-5163,Denys Fort / Habitation National Historic Site,47.8801,-64.5885,FN77qv,CA-NB,4,4,227,0,0
CA-5164,Dick's Island Nature Reserve,45.1402,-66.9973,FN65md,CA-NB,0,0,0,0,0
CA-5165,Dolan Woodlands Nature Reserve,46.9707,-65.5486,FN76fx,CA-NB,3,3,116,0,0
CA-5166,Dominion Park Recreation Park,45.2692,-66.1227,FN65wg,CA-NB,2,2,125,0,0
CA-5167,Eagle's Eye Nature Reserve,46.3599,-67.5616,FN66fi,CA-NB,0,0,0,0,0
CA-5168,Hudson Bay Park,49.1616,-122.586,CN89qd,CA-BC,18,17,425,0,0
CA-5169,East Riverside Kingshurst Park Recreation Park,45.3732,-66.0087,FN65xi,CA-NB,4,4,262,0,0
CA-5170,Fallsview Park Recreation Park,45.2646,-66.0882,FN65wg,CA-NB,4,4,149,0,0
CA-5171,Ferris Street Forest and Wetland Nature Reserve,45.9805,-66.6873,FN65px,CA-NB,1,1,13,0,0
CA-5172,Fredericton Botanic Garden Conservation Area,45.9488,-66.6813,FN65pw,CA-NB,3,3,168,0,0
CA-5173,Fredericton Military National Historic Site,45.9626,-66.6406,FN65qx,CA-NB,2,2,106,0,0
CA-5174,Fredericton Railway Bridge (Bill Thorpe Walking Bridge) Recreation Site,45.9565,-66.6325,FN65qw,CA-NB,0,0,0,0,0
CA-5175,Free Meeting House National Historic Site,46.0939,-64.7739,FN76oc,CA-NB,12,12,491,0,0
CA-5176,Frye Island Protected Area,45.0614,-66.8394,FN65nb,CA-NB,0,0,0,0,0
CA-5177,Frye Lake Nature Reserve,48.0148,-64.5251,FN78ra,CA-NB,5,5,232,0,0
CA-5178,George M Stirrett Nature Reserve,46.8501,-67.6897,FN66du,CA-NB,0,0,0,0,0
