reference,name,latitude,longitude,grid,locationDesc,attempts,activations,qsos,my_activations,my_hunted_qsos
CA-1595,Altona Forest Conservation Area,43.8281,-79.141,FN03kt,CA-ON,44,42,1274,0,0
CA-1596,Hog's Back Conservation Reserve,45.3717,-75.695,FN25di,CA-ON,102,93,2539,0,1
CA-1597,Rockcliffe Park and the Rockeries Natural Area,45.4507,-75.6866,FN25dk,CA-ON,211,56,2110,0,0
CA-1598,Rockway Conservation Reserve,43.1111,-79.322,FN03ic,CA-ON,38,37,961,0,0
CA-1599,South Point Trail (Rondeau) Provincial Park,42.263,-81.8468,EN92bg,CA-ON,7,7,197,0,0
CA-1600,Rose Lake Dune Peatland Complex Conservation Reserve,46.3789,-83.6627,EN86ej,CA-ON,1,1,26,0,0
CA-1601,Ryerson Township Forest Conservation Reserve,45.5694,-79.5856,FN05en,CA-ON,1,1,40,0,0
CA-1602,Sahkeesuhkuh Weesuhkaheegahn Provincial Park,51.5371,-93.4868,EO31gm,CA-ON,0,0,0,0,0
CA-1604,Sankey Township Nature Reserve Wilderness Area,49.8278,-83.245,EN89jt,CA-ON,0,0,0,0,0
CA-1605,Sausage Lake Forest Conservation Reserve,45.9856,-79.2928,FN05ix,CA-ON,1,1,38,0,0
CA-1606,Scenic Lake Conservation Reserve,50.2291,-94.2141,EO20vf,CA-ON,0,0,0,0,0
CA-1607,Scotty Lake Conservation Reserve,50.3362,-94.1257,EO20wi,CA-ON,0,0,0,0,0
CA-1608,Seahorse Lake Conservation Reserve,49.1811,-87.9135,EN69be,CA-ON,0,0,0,0,0
CA-1609,Searchmont South Forest Conservation Reserve,46.7549,-84.0407,EN76xs,CA-ON,1,1,16,0,0
CA-1610,Seguin River Conservation Reserve,45.4006,-79.9733,FN05aj,CA-ON,1,1,98,0,0
CA-1612,Seguin River Conifer And Fens Conservation Reserve,49.2449,-80.2381,EN99vf,CA-ON,0,0,0,0,0
CA-1613,Severn River Conservation Reserve,44.9153,-79.5859,FN04ev,CA-ON,4,4,318,0,0
CA-1614,Shack Creek Wetland Conservation Reserve,45.0839,-79.1035,FN05kc,CA-ON,3,3,242,0,0
CA-1615,Shakespeare Forest Conservation Reserve,46.33,-81.9225,EN96ah,CA-ON,1,1,26,0,0
CA-1616,Shallow River Poplar Outwash Conservation Reserve,48.5909,-80.3285,EN98uo,CA-ON,0,0,0,0,0
CA-1617,Shanly Creek Drumlins Conservation Reserve,49.0846,-82.7124,EN89pc,CA-ON,0,0,0,0,0
CA-1618,Sharpe Bay Fen Conservation Reserve,44.6771,-78.1013,FN04wq,CA-ON,8,8,269,0,0
CA-1619,Shawanaga Lake Conservation Reserve,45.6113,-79.968,FN05ao,CA-ON,1,1,15,0,0
CA-1620,Sherman Falls Conservation Reserve,43.2387,-79.973,FN03af,CA-ON,16,16,310,0,0
CA-1621,Shirleys Bay Conservation Reserve,45.3924,-75.9318,FN25aj,CA-ON,72,53,1478,0,0
CA-1622,Shoal Lake Wilderness Area,48.6817,-92.6656,EN38qq,CA-ON,0,0,0,0,0
CA-1623,Shook Lake Conservation Reserve,49.1924,-88.9504,EN59me,CA-ON,1,1,12,0,0
CA-1624,Side Lake Conservation Reserve,49.1165,-92.2445,EN39vc,CA-ON,0,0,0,0,0
CA-1625,Sifton Township Conservation Reserve,48.9137,-94.192,EN28vv,CA-ON,1,1,31,0,0
CA-1626,Silver Creek Peatland Conservation Reserve,45.4955,-77.3114,FN15il,CA-ON,5,5,163,0,0
CA-1627,Sleeping Giant Wilderness Area,48.3208,-88.9204,EN58mh,CA-ON,6,5,70,0,0
CA-1628,Slim Jim Lake Conservation Reserve,49.6025,-85.7425,EN79do,CA-ON,0,0,0,0,0
CA-1629,Smith Lake Conservation Reserve,47.4053,-80.7676,EN97oj,CA-ON,0,0,0,0,0
CA-1630,Smoky River Headwaters Conservation Reserve,46.4816,-79.7794,FN06cl,CA-ON,1,1,60,0,0
CA-1631,Snake River Marsh Conservation Reserve,45.6563,-76.9688,FN15mp,CA-ON,5,5,180,0,0
CA-1632,Solitary Lake Conservation Reserve,50.5167,-94.2359,EO20vm,CA-ON,0,0,0,0,0
CA-1633,South Grassy Lake Outwash Conservation Reserve,48.087,-79.8028,FN08cc,CA-ON,0,0,0,0,0
CA-1634,South Greenhill Lake Sand Delta Conservation Reserve,48.4582,-83.8952,EN88bk,CA-ON,0,0,0,0,0
CA-1635,South Michipicoten River-Superior Shoreline Conservation Reserve,47.8929,-84.8102,EN77ov,CA-ON,2,2,28,0,0
CA-1636,South River Forest Conservation Reserve,45.9571,-79.4194,FN05gw,CA-ON,2,2,74,0,0
CA-1637,South Timiskaming Shoreline Conservation Reserve,46.9809,-79.3518,FN06hx,CA-ON,1,1,14,0,0
CA-1638,W.A. Taylor Conservation Reserve,45.133,-75.6333,FN25ed,CA-ON,93,84,1928,0,2
CA-1639,Spencer Gorge Conservation Reserve,43.2761,-79.976,FN03ag,CA-ON,31,31,1619,0,0
CA-1640,Spring/Cut Lake Esker Conservation Reserve,46.7672,-79.2683,FN06is,CA-ON,1,1,50,0,0
CA-1642,St. Raphael Lake Provincial Park,50.7671,-90.9017,EO40ns,CA-ON,0,0,0,0,0
CA-1643,St. Williams Conservation Reserve,42.7094,-80.3692,EN92tr,CA-ON,17,15,332,0,0
CA-1644,Ste. Therese Ground Moraine Conservation Reserve,49.8179,-83.6775,EN89dt,CA-ON,0,0,0,0,0
CA-1645,Stony Swamp Conservation Reserve,45.3028,-75.8316,FN25ch,CA-ON,62,51,1430,0,0
CA-1646,Stoney Island Conservation Area,44.2257,-81.6054,EN94ef,CA-ON,16,15,361,0,0
CA-1647,Stormy Lake Conservation Reserve,49.3489,-92.3055,EN39ui,CA-ON,0,0,0,0,0
CA-1648,Strickland River Mixed Forest Wetland Conservation Reserve,48.7722,-84.9115,EN78ns,CA-ON,0,0,0,0,0
CA-1649,Stuart Lake Wetland Conservation Reserve,46.5744,-83.8304,EN86cn,CA-ON,0,0,0,0,0
CA-1650,Sugar Lake Conservation Reserve,47.3492,-80.1206,EN97wi,CA-ON,0,0,0,0,0
CA-1651,Summit Muskeg Preserve Conservation Reserve,43.23,-80.0538,EN93xf,CA-ON,70,66,2090,0,0
CA-1652,Sutton Lake Gorge Wilderness Area,54.4169,-84.6744,EO74pk,CA-ON,0,0,0,0,0
CA-1653,Swan Lake Conservation Reserve,45.9601,-80.1406,EN95wx,CA-ON,0,0,0,0,0
CA-1654,Tatachikapika River Plain Conservation Reserve,48.2973,-81.6199,EN98eh,CA-ON,3,3,58,0,0
CA-1655,Temagami Island North Conservation Reserve,46.9743,-80.0372,EN96xx,CA-ON,7,4,151,0,0
CA-1656,Tembec Wetland Complex Conservation Reserve,49.6279,-79.5683,FN09fp,CA-ON,0,0,0,0,0
CA-1657,Glengarry Landing National Historic Site,44.4509,-79.9012,FN04bk,CA-ON,113,113,6829,0,0
CA-1658,Sunnidale Recreation Park,44.398,-79.7103,FN04dj,CA-ON,412,409,19058,0,0
CA-1659,Dumfries Conservation Area,43.3878,-80.3354,EN93tj,CA-ON,26,25,702,0,0
CA-1660,Edenvale Conservation Area,44.4538,-79.9023,FN04bk,CA-ON,120,120,7097,0,0
CA-1661,Fort Willow Conservation Area,44.3941,-79.8199,FN04cj,CA-ON,229,225,10136,0,0
CA-1662,Thessalon River Delta/Rock Lake Red Oak Conservation Reserve,46.4506,-83.7561,EN86ck,CA-ON,2,2,84,0,0
CA-1663,Three Mile Narrows Conservation Reserve,49.1874,-87.0532,EN69le,CA-ON,0,0,0,0,0
CA-1664,Tikamaganda Lake Conservation Reserve,47.556,-84.1814,EN77vn,CA-ON,0,0,0,0,0
CA-1665,Tilley Creek West Conservation Reserve,46.9822,-84.4167,EN76sx,CA-ON,0,0,0,0,0
CA-1666,Tilton Forest Conservation Reserve,46.3409,-81.0595,EN96li,CA-ON,2,2,64,0,0
CA-1667,Timber Island Wilderness Area,43.9539,-76.8414,FN13nw,CA-ON,0,0,0,0,0
CA-1668,Toogood Pond Park Conservation Reserve,43.8755,-79.3181,FN03iv,CA-ON,34,34,1046,0,0
CA-1669,Torrance Barrens Conservation Reserve,44.9516,-79.5031,FN04fw,CA-ON,11,11,507,0,0
CA-1670,Trewartha Creek Conservation Reserve,49.1399,-90.7417,EN49pd,CA-ON,1,1,16,0,0
CA-1671,Trollope Lake Burnt Hill Poplar Spruce Conservation Reserve,48.5778,-79.6774,FN08dn,CA-ON,0,0,0,0,0
CA-1672,Trout Lake Conservation Reserve,51.2538,-93.4777,EO31gg,CA-ON,0,0,0,0,0
CA-1673,Little Cataraqui Creek Conservation Area,44.283,-76.5076,FN14rg,CA-ON,17,17,499,0,0
CA-1674,Twilight Lake Conservation Reserve,50.0959,-93.3977,EO30hc,CA-ON,0,0,0,0,0
CA-1675,Upper English River Conservation Reserve,49.716,-90.8923,EN49nr,CA-ON,0,0,0,0,0
CA-1676,Upper Raft Lake Conservation Reserve,45.4988,-79.1469,FN05kl,CA-ON,1,1,15,0,0
CA-1677,Upper Shebeshekong Wetland Conservation Reserve,45.4818,-80.3487,EN95tl,CA-ON,4,4,153,0,0
CA-1678,New Lowell Conservation Area,44.3527,-79.9744,FN04ai,CA-ON,37,37,2217,0,0
CA-1679,Venetian Creek Old Pine Conservation Reserve,46.8775,-81.3035,EN96iv,CA-ON,0,0,0,0,0
CA-1680,Vimy Lake Uplands Conservation Reserve,48.2182,-82.2125,EN88vf,CA-ON,2,2,40,0,0
CA-1681,Wabos North Conservation Reserve,46.8443,-84.1218,EN76wu,CA-ON,1,1,30,0,0
CA-1682,Wabos South Conservation Reserve,46.805,-84.113,EN76wt,CA-ON,0,0,0,0,0
CA-1683,Wagong Lake Forest Conservation Reserve,47.1684,-82.9126,EN87ne,CA-ON,0,0,0,0,0
CA-1684,Wahwashkesh-Naiscoot Conservation Reserve,45.6589,-80.2021,EN95vp,CA-ON,9,6,123,0,0
CA-1685,Wainfleet Bog Conservation Reserve,42.9242,-79.2808,FN02iw,CA-ON,20,20,678,0,1
CA-1686,Wakami Lake Provincial Park Addition Provincial Park,47.4726,-82.7875,EN87ol,CA-ON,0,0,0,0,0
CA-1687,Wapus Creek Conservation Reserve,47.5094,-80.9363,EN97mm,CA-ON,0,0,0,0,0
CA-1688,Ward McKenna Conservation Area,42.7623,-80.9903,EN92ms,CA-ON,15,13,440,0,0
CA-1689,Warkworth Conservation Area,44.2,-77.89,FN14be,CA-ON,23,23,639,0,0
CA-1690,Warsaw Caves Conservation Area,44.462,-78.1308,FN04wl,CA-ON,19,19,365,0,0
CA-1691,Warwick Conservation Area,42.9974,-81.9471,EN92ax,CA-ON,11,11,411,0,0
CA-1692,Waterford North Conservation Reserve,42.9309,-80.3174,EN92uw,CA-ON,19,19,702,0,1
CA-1694,Watson Dam Conservation Area,42.8167,-80.6833,EN92pt,CA-ON,11,10,401,0,0
CA-1695,Lake Wawanosh Conservation Area,43.8833,-81.4833,EN93gv,CA-ON,10,9,192,0,0
CA-1696,Wawanosh Park Conservation Area,43.8275,-81.4598,EN93gt,CA-ON,13,13,309,0,0
CA-1697,Wawanosh Valley Conservation Area,43.8261,-81.4573,EN93gt,CA-ON,16,16,413,0,0
CA-1698,Wawanosh Wetlands Conservation Area,42.9949,-82.3274,EN82ux,CA-ON,23,22,605,0,0
CA-1699,Weeskayjahk Ohtahzhoganeeng Provincial Park,51.9732,-94.4243,EO21sx,CA-ON,0,0,0,0,0
CA-1700,West Wabigoon River Conservation Reserve,49.9045,-93.3122,EN39iv,CA-ON,0,0,0,0,0
CA-1701,Westmeath Bog Conservation Reserve,45.7685,-76.8645,FN15ns,CA-ON,3,3,96,0,0
CA-1702,White Bear Forest Conservation Reserve,47.0466,-79.7523,FN07cb,CA-ON,2,2,76,0,0
CA-1703,White Lake Conservation Reserve,45.2896,-76.5103,FN15rg,CA-ON,7,7,229,0,0
CA-1704,White Lake Peatlands Provincial Nature Reserve,48.8647,-85.5599,EN78fu,CA-ON,0,0,0,0,0
CA-1705,White Otter Lake Wilderness Area,49.1719,-91.9094,EN49be,CA-ON,1,1,46,0,0
CA-1706,Whitefish Lakes Conservation Reserve,48.1224,-80.7142,EN98pc,CA-ON,0,0,0,0,0
CA-1707,Whitefish Falls Wilderness Area,48.3595,-83.6732,EN88di,CA-ON,1,1,13,0,0
CA-1708,Whitefish River Sandy Till Conservation Reserve,48.0587,-80.8927,EN98nb,CA-ON,0,0,0,0,0
CA-1709,Whitemud Conservation Reserve,50.7162,-92.439,EO30sr,CA-ON,0,0,0,0,0
CA-1710,Whitesand Provincial Park,50.4504,-88.6779,EO50pk,CA-ON,1,1,12,0,0
CA-1711,Widdifield Forest Provincial Park,46.4473,-79.3253,FN06ik,CA-ON,1,1,20,0,0
CA-1712,Widgeon Lake Moraine Conservation Reserve,48.2115,-85.4821,EN78gf,CA-ON,0,0,0,0,0
CA-1713,Wildgoose Outwash Deposit Provincial Park,48.389,-80.435,EN98sj,CA-ON,0,0,0,0,0
CA-1714,Willow Lake Conservation Reserve,49.7931,-90.8189,EN49ot,CA-ON,0,0,0,0,0
CA-1715,Windermere Goldie Lake Complex Conservation Reserve,47.9792,-83.838,EN87bx,CA-ON,0,0,0,0,0
CA-1716,Abraham Lake Nature Reserve,45.1626,-62.6234,FN85qd,CA-NS,1,1,98,0,0
CA-1717,Alder Grounds Wilderness Area,45.1383,-62.297,FN85ud,CA-NS,0,0,0,0,0
CA-1718,Amherst Point Bird Sanctuary,45.7963,-64.2432,FN75vt,CA-NS,8,8,454,0,0
CA-1719,Angevine Lake Nature Reserve,45.7389,-63.5236,FN85fr,CA-NS,0,0,0,0,0
CA-1720,Aylesford Mountain Nature Reserve,45.0921,-64.841,FN75nc,CA-NS,3,3,76,0,0
CA-1721,Baddeck River Wilderness Area,46.2601,-60.7698,FN96og,CA-NS,0,0,0,0,0
CA-1722,Baleine Nature Reserve,45.9507,-59.8162,GN05cw,CA-NS,0,0,0,0,0
CA-1723,Barneys River Nature Reserve,45.5921,-62.2608,FN85uo,CA-NS,0,0,0,0,0
CA-1724,Barrachois Provincial Park,46.1425,-60.4444,FN96sd,CA-NS,2,2,28,0,0
CA-1726,Bennery Lake Nature Reserve,44.8887,-63.5509,FN84fv,CA-NS,1,1,20,0,0
CA-1727,Big Glace Bay Lake Bird Sanctuary,46.175,-59.9333,GN06ae,CA-NS,0,0,0,0,0
CA-1728,Black River Bog Nature Reserve,46.1627,-61.2762,FN96id,CA-NS,1,1,22,0,0
CA-1729,Blandford Nature Reserve,44.5482,-64.094,FN74wn,CA-NS,1,1,18,0,0
CA-1730,Blue Mountain - Birch Cove Lakes Wilderness Area,44.6789,-63.7279,FN84dq,CA-NS,4,4,146,0,0
CA-1731,Boggy Lake Wilderness Area,45.0956,-62.3181,FN85uc,CA-NS,0,0,0,0,0
CA-1732,Bonnet Lake Barrens Wilderness Area,45.2844,-61.3561,FN95hg,CA-NS,0,0,0,0,0
CA-1733,Bornish Hill Nature Reserve,45.9033,-61.2819,FN95iv,CA-NS,0,0,0,0,0
CA-1734,Bowers Meadows Wilderness Area,43.6312,-65.4133,FN73hp,CA-NS,4,4,82,0,0
CA-1735,Cains Mountain Wilderness Area,45.9865,-60.8827,FN95nx,CA-NS,0,0,0,0,0
CA-1736,Calvary River Nature Reserve,45.4186,-63.0162,FN85lk,CA-NS,0,0,0,0,0
CA-1737,Canso Coastal Barrens Wilderness Area,45.2743,-61.0975,FN95kg,CA-NS,0,0,0,0,0
CA-1738,Caribou Rivers Nature Reserve,45.7464,-62.7808,FN85or,CA-NS,1,1,20,0,0
CA-1739,Cedar Lake Nature Reserve,44.0138,-66.1137,FN64wa,CA-NS,2,2,116,0,0
CA-1740,Chignecto Isthmus Wilderness Area,45.9152,-64.1215,FN75wv,CA-NS,9,9,314,0,0
CA-1741,Chimney Corner Nature Reserve,46.35,-61.131,FN96ki,CA-NS,0,0,0,0,0
CA-1742,Clattenburgh Brook Wilderness Area,44.8651,-63.4147,FN84hu,CA-NS,1,1,20,0,0
CA-1743,Cloud Lake Wilderness Area,44.8096,-64.9144,FN74nt,CA-NS,1,1,15,0,0
CA-1744,Cowan Brook Nature Reserve,44.878,-62.928,FN84mv,CA-NS,0,0,0,0,0
CA-1745,Dalhousie Mountain Nature Reserve,45.5619,-62.9592,FN85mn,CA-NS,2,2,42,0,0
CA-1746,Denis Lakes Wilderness Area,45.143,-62.41,FN85td,CA-NS,0,0,0,0,0
CA-1747,Devils Jaw Wilderness Area,44.9888,-63.746,FN84dx,CA-NS,2,2,76,0,0
CA-1748,Diligent River Nature Reserve,45.395,-64.4423,FN75sj,CA-NS,0,0,0,0,0
CA-1749,Dochertys Brook Nature Reserve,45.771,-63.6177,FN85es,CA-NS,1,1,21,0,0
CA-1750,Drug Brook Nature Reserve,45.4,-62.681,FN85pj,CA-NS,3,3,118,0,0
CA-1751,Duncans Cove Nature Reserve,44.5027,-63.5352,FN84fm,CA-NS,6,6,196,0,0
CA-1752,Dunraven Bog Nature Reserve,43.94,-64.994,FN73mw,CA-NS,0,0,0,0,0
CA-1753,Eagles Nest Nature Reserve,44.883,-64.0247,FN74xv,CA-NS,0,0,0,0,0
CA-1754,Eastern Shore Islands Wilderness Area,44.739,-62.767,FN84or,CA-NS,0,0,0,0,0
CA-1755,Economy Point Nature Reserve,45.363,-63.897,FN85bi,CA-NS,0,0,0,0,0
CA-1756,Economy River Wilderness Area,45.507,-63.955,FN85am,CA-NS,2,2,175,0,0
CA-1757,Eigg Mountain - James River Wilderness Area,45.6682,-62.1419,FN85wq,CA-NS,0,0,0,0,0
CA-1758,Eighteen Mile Brook Nature Reserve,44.2698,-64.9334,FN74mg,CA-NS,2,2,44,0,0
CA-1759,Elderbank Provincial Park,44.98,-63.2174,FN84jx,CA-NS,7,7,237,0,0
CA-1760,Five Bridge Lakes Wilderness Area,44.627,-63.8188,FN84cp,CA-NS,5,5,150,0,0
CA-1761,Fossil Coast Nature Reserve,45.7472,-64.4201,FN75sr,CA-NS,3,3,162,0,0
CA-1762,Fourchu Coast Wilderness Area,45.7019,-60.3175,FN95uq,CA-NS,1,1,25,0,0
CA-1763,French River Wilderness Area,46.4802,-60.5697,FN96rl,CA-NS,0,0,0,0,0
CA-1764,Gabarus Wilderness Area,45.8071,-60.1278,FN95wt,CA-NS,0,0,0,0,0
CA-1765,Ghost Antler Nature Reserve,43.8906,-65.3223,FN73iv,CA-NS,0,0,0,0,0
CA-1766,Blomidon Lookoff Provincial Park,45.1995,-64.409,FN75te,CA-NS,29,29,1409,0,0
CA-1768,Gully Lake Wilderness Area,45.5465,-63.0698,FN85ln,CA-NS,0,0,0,0,0
CA-1769,Haley Lake Migratory Bird Sanctuary,43.8315,-64.9939,FN73mt,CA-NS,0,0,0,0,0
CA-1770,Harrison Woods Nature Reserve,45.7379,-64.2997,FN75ur,CA-NS,0,0,0,0,0
CA-1771,Hubbards Provincial Park,44.639,-64.0606,FN74xp,CA-NS,12,12,341,0,0
CA-1772,Humes River Wilderness Area,46.04,-61.008,FN96la,CA-NS,0,0,0,0,0
CA-1773,Indian Man Lake Nature Reserve,45.3141,-62.2481,FN85vh,CA-NS,0,0,0,0,0
CA-1775,Irish Cove Nature Reserve,45.8046,-60.6701,FN95pt,CA-NS,0,0,0,0,0
CA-1776,Janvrin Island Nature Reserve,45.5436,-61.137,FN95kn,CA-NS,0,0,0,0,0
CA-1777,Jim Campbells Barren Wilderness Area,46.5645,-60.9126,FN96nn,CA-NS,0,0,0,0,0
CA-1778,Kelley River Wilderness Area,45.5694,-64.4588,FN75sn,CA-NS,1,1,35,0,0
CA-1779,Kennetcook River Nature Reserve,45.2152,-63.5934,FN85ef,CA-NS,0,0,0,0,0
CA-1780,Kentville Migratory Bird Sanctuary,45.0813,-64.511,FN75rb,CA-NS,59,59,4090,0,2
CA-1781,Kluscap Wilderness Area,46.3014,-60.4668,FN96sh,CA-NS,0,0,0,0,0
CA-1782,Lake Egmont Nature Reserve,44.99,-63.2777,FN84ix,CA-NS,0,0,0,0,0
CA-1783,Lake Rossignol Wilderness Area,44.241,-65.038,FN74lf,CA-NS,0,0,0,0,0
CA-1784,Lambs Lake Nature Reserve,44.67,-65.4309,FN74gq,CA-NS,0,0,0,0,0
CA-1785,Liscomb River Wilderness Area,45.0815,-62.1126,FN85wb,CA-NS,0,0,0,0,0
CA-1786,Little Beaver Lakes Nature Reserve,45.855,-61.007,FN95lu,CA-NS,0,0,0,0,0
CA-1788,Long Lake Nature Reserve,44.6425,-64.2168,FN74vp,CA-NS,0,0,0,0,0
CA-1789,Lyons Marsh Nature Reserve,45.4016,-63.759,FN85cj,CA-NS,0,0,0,0,0
CA-1790,MacAulays Hill Nature Reserve,46.1377,-60.662,FN96qd,CA-NS,0,0,0,0,0
CA-1791,MacElmons Pond Provincial Park,45.3909,-63.4282,FN85gj,CA-NS,16,15,1016,0,0
CA-1792,MacFarlane Woods Nature Reserve,46.014,-61.375,FN96ha,CA-NS,0,0,0,0,0
CA-1793,MacKay Brook Nature Reserve,45.6228,-62.956,FN85mo,CA-NS,0,0,0,0,0
CA-1794,Marie Joseph Provincial Park,44.9674,-62.0868,FN84wx,CA-NS,2,2,30,0,0
CA-1795,Margaree River Wilderness Area,46.527,-60.8553,FN96nm,CA-NS,0,0,0,0,0
CA-1796,Martin Brook Nature Reserve,44.091,-65.293,FN74ic,CA-NS,0,0,0,0,0
CA-1798,Masons Mountain Nature Reserve,46.253,-61.183,FN96jg,CA-NS,1,0,6,0,0
CA-1799,McCormacks Beach Provincial Park,44.6076,-63.4927,FN84go,CA-NS,13,13,416,0,0
CA-1800,McGill Lake Wilderness Area,44.694,-65.0368,FN74lq,CA-NS,0,0,0,0,0
CA-1801,Medway Lakes Wilderness Area,44.586,-65.189,FN74jo,CA-NS,0,0,0,0,0
CA-1802,Middle River Wilderness Area,46.2544,-60.9037,FN96ng,CA-NS,1,1,60,0,0
CA-1803,Middle River - Framboise Wilderness Area,45.7881,-60.4431,FN95ss,CA-NS,0,0,0,0,0
CA-1804,Montrose Nature Reserve,45.4366,-63.6952,FN85dk,CA-NS,0,0,0,0,0
CA-1805,Moose River Gold Mines Provincial Park,44.9816,-62.9431,FN84mx,CA-NS,9,6,267,0,0
CA-1808,North Mountain Wilderness Area,45.7851,-61.1748,FN95js,CA-NS,0,0,0,0,0
CA-1809,North River Wilderness Area,46.3052,-60.664,FN96qh,CA-NS,0,0,0,0,0
CA-1810,Northport Beach Provincial Park,45.9269,-63.8441,FN85bw,CA-NS,8,8,619,0,0
CA-1811,Northwest Brook Nature Reserve,43.8,-65.156,FN73kt,CA-NS,3,3,67,0,0
CA-1812,Ogden Round Lake Wilderness Area,45.4073,-61.6406,FN95ej,CA-NS,0,0,0,0,0
CA-1813,Old Annapolis Road Nature Reserve,44.7612,-63.946,FN84as,CA-NS,1,1,36,0,0
CA-1814,Panuke Lake Nature Reserve,44.79,-64.111,FN74ws,CA-NS,0,0,0,0,0
CA-1815,Petite Bog Nature Reserve,45.1405,-63.926,FN85ad,CA-NS,0,0,0,0,0
CA-1816,Pockwock Wilderness Area,44.821,-63.855,FN84bt,CA-NS,2,2,40,0,0
CA-1818,Polletts Cove - Aspy Fault Wilderness Area,46.9103,-60.6019,FN96qv,CA-NS,0,0,0,0,0
CA-1819,Polly Brook Wilderness Area,45.6534,-63.9851,FN85ap,CA-NS,0,0,0,0,0
CA-1820,Ponhook Lake Nature Reserve,44.319,-64.897,FN74nh,CA-NS,1,1,10,0,0
CA-1821,Porcupine Lake Wilderness Area,44.267,-65.959,FN74ag,CA-NS,0,0,0,0,0
CA-1822,Port Hebert Migratory Bird Sanctuary,43.8565,-64.9612,FN73mu,CA-NS,2,2,30,0,0
CA-1823,Port Joli Migratory Bird Sanctuary,43.8683,-64.906,FN73nu,CA-NS,1,1,21,0,0
CA-1824,Port L'Hebert Nature Reserve,43.837,-65.0077,FN73lu,CA-NS,4,4,194,0,0
CA-1825,Port La Tour Bogs Wilderness Area,43.52,-65.521,FN73fm,CA-NS,2,2,82,0,0
CA-1826,Portapique River Wilderness Area,45.5244,-63.744,FN85dm,CA-NS,1,1,38,0,0
CA-1827,Quinns Meadow Nature Reserve,43.663,-65.458,FN73gp,CA-NS,2,2,35,0,0
CA-1828,Raven Head Wilderness Area,45.5398,-64.6789,FN75pm,CA-NS,2,2,46,0,0
CA-1829,Rawdon River Nature Reserve,44.8583,-63.6339,FN84eu,CA-NS,3,3,93,0,0
CA-1830,River Inhabitants Nature Reserve,45.675,-61.27,FN95iq,CA-NS,0,0,0,0,0
CA-1832,Rogues Roost Wilderness Area,44.494,-63.752,FN84cl,CA-NS,4,4,102,0,0
CA-1833,Roman Valley Nature Reserve,45.4477,-61.685,FN95dk,CA-NS,0,0,0,0,0
CA-1834,Roseway River Wilderness Area,43.903,-65.413,FN73hv,CA-NS,2,2,67,0,0
CA-1835,Ruiss Noir Wilderness Area,46.484,-61.009,FN96ll,CA-NS,0,0,0,0,0
CA-1836,Rush Lake Nature Reserve,45.2108,-62.479,FN85sf,CA-NS,0,0,0,0,0
CA-1837,Sable River Migratory Bird Sanctuary,43.8078,-65.0216,FN73lt,CA-NS,7,7,318,0,0
CA-1838,Sackville River Protected Area,44.866,-63.728,FN84du,CA-NS,3,3,125,0,0
CA-1839,Scatarie Island Wilderness Area,46.0103,-59.7315,GN06da,CA-NS,0,0,0,0,0
CA-1840,Scrag Lake Wilderness Area,44.591,-64.918,FN74mo,CA-NS,0,0,0,0,0
CA-1841,Seal Cove Nature Reserve,45.885,-61.093,FN95kv,CA-NS,0,0,0,0,0
CA-1842,Seven Falls Nature Reserve,46.198,-60.968,FN96me,CA-NS,0,0,0,0,0
CA-1843,Shelburne Heritage River Wilderness Area,44.2658,-65.286,FN74ig,CA-NS,0,0,0,0,0
CA-1845,Cape Jack Beach Provincial Park,45.683,-61.574,FN95fq,CA-NS,3,2,85,0,0
CA-1846,Pu’tlaqne’katik (Shingle Lake) Wilderness Area,44.4284,-64.8111,FN74ok,CA-NS,2,2,61,0,0
CA-1847,Ship Harbour Long Lake Wilderness Area,44.909,-63.0637,FN84lv,CA-NS,1,1,28,0,0
CA-1848,Shubie Park Recreation Park,44.7024,-63.5542,FN84fq,CA-NS,24,22,525,0,1
CA-1849,Shubenacadie Provincial  Park Provincial Wildlife Area,45.092,-63.3955,FN85hc,CA-NS,11,11,372,0,0
CA-1850,Sugarloaf Mountain Wilderness Area,46.4206,-60.9335,FN96mk,CA-NS,0,0,0,0,0
CA-1851,Shut-in Island Nature Reserve,44.548,-63.957,FN84an,CA-NS,0,0,0,0,0
CA-1852,Silver River Wilderness Area,44.214,-65.808,FN74cf,CA-NS,0,0,0,0,0
CA-1853,Sissiboo River Wilderness Area,44.414,-65.843,FN74bj,CA-NS,0,0,0,0,0
CA-1854,Sixth and Coades Lakes Nature Reserve,44.125,-65.191,FN74jd,CA-NS,0,0,0,0,0
CA-1855,Skull Bog Lake Nature Reserve,44.596,-65.076,FN74lo,CA-NS,0,0,0,0,0
CA-1856,Slade Lake Nature Reserve,45.7115,-63.92,FN85ar,CA-NS,0,0,0,0,0
CA-1857,Sloans Lake Nature Reserve,43.977,-65.916,FN73bx,CA-NS,0,0,0,0,0
CA-1858,Smith Lake Nature Reserve,44.49,-64.844,FN74nl,CA-NS,0,0,0,0,0
CA-1859,Snowshoe Lakes Nature Reserve,44.536,-65.175,FN74jm,CA-NS,0,0,0,0,0
CA-1860,Cape George Provincial Park,45.871,-61.899,FN95bu,CA-NS,4,4,154,0,0
CA-1861,South Panuke Wilderness Area,44.691,-64.1936,FN74vq,CA-NS,0,0,0,0,0
CA-1862,South River Nature Reserve,45.523,-61.928,FN95am,CA-NS,0,0,0,0,0
CA-1863,Southern Bight-Minas Basin Ramsar Site,45.2166,-64.2666,FN75uf,CA-NS,26,26,1650,0,0
CA-1864,Southwest Mabou River Nature Reserve,45.967,-61.386,FN95hx,CA-NS,0,0,0,0,0
CA-1865,Spinneys Heath Nature Reserve,43.773,-65.819,FN73cs,CA-NS,0,0,0,0,0
CA-1866,Sporting Lake Nature Reserve,44.2876,-65.5936,FN74eg,CA-NS,0,0,0,0,0
CA-1867,Spry Bay Provincial Park,44.842,-62.62,FN84qu,CA-NS,3,3,53,0,0
CA-1869,St. Anns Bank Marine Marine Protected Area,45.99,-59.1,GN05kx,CA-NS,0,0,0,0,0
CA-1870,St. Margarets Bay Islands Nature Reserve,44.58,-63.94,FN84an,CA-NS,0,0,0,0,0
CA-1872,Judd's Pool Provincial Park,45.019,-62.208,FN85va,CA-NS,0,0,0,0,0
CA-1873,Steepbank Brook Nature Reserve,45.712,-63.862,FN85br,CA-NS,1,1,67,0,0
CA-1875,Sugar Harbour Islands Nature Reserve,45.2254,-61.2485,FN95jf,CA-NS,0,0,0,0,0
CA-1876,Irish Cove Provincial Park,45.8155,-60.6911,FN95pt,CA-NS,4,4,200,0,0
CA-1878,Tait Lake Nature Reserve,45.09,-62.739,FN85pc,CA-NS,0,0,0,0,0
CA-1879,Tangier Grand Lake Wilderness Area,44.8788,-62.782,FN84ov,CA-NS,0,0,0,0,0
CA-1880,Tatamagouche Provincial Park,45.707,-63.268,FN85iq,CA-NS,9,9,772,0,0
CA-1882,Ten Mile Lake Provincial Park,44.1895,-64.8351,FN74ne,CA-NS,8,7,182,0,0
CA-1883,Tennycape River Nature Reserve,45.2615,-63.807,FN85cg,CA-NS,0,0,0,0,0
CA-1884,Terence Bay Wilderness Area,44.522,-63.672,FN84dm,CA-NS,4,4,134,0,0
CA-1885,The Big Bog Wilderness Area,45.183,-62.1,FN85we,CA-NS,0,0,0,0,0
CA-1886,Lower East Chezzetcook Provincial Park,44.69,-63.1885,FN84jq,CA-NS,3,3,158,0,0
CA-1887,The Stillwaters Wilderness Area,45.941,-60.063,FN95xw,CA-NS,0,0,0,0,0
CA-1888,Tiddville Nature Reserve,44.416,-66.164,FN64wj,CA-NS,0,0,0,0,0
CA-1889,Tidney River Wilderness Area,43.9486,-65.067,FN73lw,CA-NS,5,4,146,0,0
CA-1890,Toadfish Lakes Wilderness Area,45.059,-62.384,FN85tb,CA-NS,0,0,0,0,0
CA-1891,Tobacco Island Nature Reserve,45.0174,-61.9151,FN95ba,CA-NS,0,0,0,0,0
CA-1892,Tobeatic Wilderness Area,44.2099,-65.4464,FN74gf,CA-NS,3,3,46,0,0
CA-1893,Open Hearth Park Recreation Park,46.1468,-60.1881,FN96vd,CA-NS,7,7,210,0,0
CA-1894,Torbrook Nature Reserve,44.894,-64.995,FN74mv,CA-NS,1,1,13,0,0
CA-1895,Tracadie River Wilderness Area,45.513,-61.637,FN95em,CA-NS,0,0,0,0,0
CA-1897,Trout Brook Wilderness Area,46.0928,-61.0824,FN96lc,CA-NS,0,0,0,0,0
CA-1898,Tupper Lake Nature Reserve,44.452,-64.974,FN74mk,CA-NS,0,0,0,0,0
CA-1899,Tusket Islands Wilderness Area,43.7361,-65.9989,FN73ar,CA-NS,1,1,17,0,0
CA-1900,Tusket River Wilderness Area,43.951,-65.825,FN73cw,CA-NS,1,1,10,0,0
CA-1901,Tusket River Ecological Area Wilderness Area,43.9548,-65.7895,FN73cw,CA-NS,0,0,0,0,0
CA-1902,Tusket River Lookoff Provincial Park,43.8647,-65.9804,FN73au,CA-NS,4,4,138,0,0
CA-1903,Tusket River Nature Reserve,43.9495,-65.7918,FN73cw,CA-NS,1,1,16,0,0
CA-1904,Blind Bay Provincial Park,44.53,-63.8416,FN84bm,CA-NS,4,4,193,0,0
CA-1905,Twelve Mile Stream Wilderness Area,45.078,-62.565,FN85rb,CA-NS,0,0,0,0,0
CA-1907,Walton River Wilderness Area,45.175,-63.893,FN85be,CA-NS,0,0,0,0,0
CA-1909,Waverley-Salmon River Long Lake Wilderness Area,44.7983,-63.4781,FN84gt,CA-NS,1,1,65,0,0
CA-1910,Wentworth Lake Nature Reserve,44.19,-65.925,FN74ae,CA-NS,0,0,0,0,0
CA-1911,Wentworth Valley Wilderness Area,45.583,-63.527,FN85fn,CA-NS,1,1,56,0,0
CA-1912,West Branch Medway River Nature Reserve,44.574,-65.132,FN74kn,CA-NS,1,1,13,0,0
CA-1913,West Dover Provincial Park,44.494,-63.8815,FN84bl,CA-NS,39,39,1722,0,0
CA-1914,Owls Head Provincial Park,44.722,-62.837,FN84nr,CA-NS,2,2,123,0,0
CA-1915,White Lake Wilderness Area,44.844,-63.15,FN84ku,CA-NS,1,1,62,0,0
CA-1916,Abbaye Cistercienne de Rougemont Nature Reserve,45.4586,-73.0548,FN35ll,CA-QC,3,3,30,0,0
CA-1917,Academie des Sacres-Coeurs Nature Reserve,45.5466,-73.3028,FN35in,CA-QC,2,2,20,0,0
CA-1918,Aigle-a-Tete-Blanche Ecological Reserve,46.2083,-77.6764,FN16de,CA-QC,3,3,96,0,0
CA-1919,Alton-E.-Peck Nature Reserve,45.4468,-72.0941,FN35wk,CA-QC,2,2,32,0,0
CA-1920,Alvar-d'Aylmer Nature Reserve,45.4387,-75.8736,FN25bk,CA-QC,5,5,144,0,0
CA-1921,Amala Nature Reserve,45.1123,-72.6917,FN35pc,CA-QC,2,2,32,0,0
CA-1922,Banc-des-AmÃ©ricains Marine Nature Reserve,48.6091,-64.0352,FN78xo,CA-QC,0,0,0,0,0
CA-1923,Andre-Linteau Ecological Reserve,46.2078,-77.7736,FN16ce,CA-QC,3,3,96,0,0
CA-1924,Andre-Michaux Ecological Reserve,45.8248,-75.8941,FN25bt,CA-QC,3,3,96,0,0
CA-1925,Réserve naturelle de l’Annedda Nature Reserve,45.7328,-72.2212,FN35vr,CA-QC,7,7,173,0,0
CA-1926,Annemarie-Zeiss-Kunerth Nature Reserve,45.269,-72.5519,FN35rg,CA-QC,3,3,96,0,0
CA-1927,Archipel-du-Mitan Nature Reserve,45.6852,-73.5376,FN35fq,CA-QC,3,3,96,0,0
CA-1928,Ashuapmushuan Nature Reserve,48.8104,-72.7327,FN38pt,CA-QC,9,7,271,0,0
CA-1929,Baie Comeau Important Bird Area Nature Reserve,49.2305,-68.1339,FN59wf,CA-QC,2,1,18,0,0
CA-1930,Baie aux Feuilles National Park Reserve,0,0,JJ00aa,CA-QC,0,0,0,0,0
